Attribute,Description,Valid Values,Requires,Properties,Required,Parent
Silmitasertib,Silmitasertib selectively binds to and inhibits the enzyme casein kinase II (CK2); [http://purl.obolibrary.org/obo/NCIT_C98054],,,,FALSE,secondCompoundName
SNS-032,A small aminothiazole molecule and cyclin dependent kinase (CDK) inhibitor with potential antineoplastic activity.; [http://purl.obolibrary.org/obo/NCIT_C62523],,,,FALSE,secondCompoundName
SR-3029,Highly selective casein kinase 1delta/1epsilon inhibitor with potent antiproliferative properties.; [https://www.ncbi.nlm.nih.gov/mesh/67585785],,,,FALSE,secondCompoundName
THZ1,A low nanomolar inhibitor of cell proliferation and biochemical CDK7 activity.; [https://www.ncbi.nlm.nih.gov/pmc/articles/PMC4244910/],,,,FALSE,secondCompoundName
UMI-77,An Mcl-1 inhibitor.; [https://www.ncbi.nlm.nih.gov/mesh/2003359],,,,FALSE,secondCompoundName
Volasertib,A dihydropteridinone Polo-like kinase 1 (Plk1) inhibitor with potential antineoplastic activity.; [http://purl.obolibrary.org/obo/NCIT_C79844],,,,FALSE,secondCompoundName
Fimepinostat,"An orally bioavailable inhibitor of both phosphoinositide 3-kinase (PI3K) class I and pan histone deacetylase (HDAC) enzymes, with potential antineoplastic activity.; [http://purl.obolibrary.org/obo/NCIT_C104008]",,,,FALSE,secondCompoundName
Brigatinib,An orally available inhibitor of receptor tyrosine kinases anaplastic lymphoma kinase (ALK) and the epidermal growth factor receptor (EGFR) with potential antineoplastic activity.; [http://purl.obolibrary.org/obo/NCIT_C98831],,,,FALSE,secondCompoundName
Omipalisib,A small-molecule pyridylsulfonamide inhibitor of phosphatidylinositol 3-kinase (PI3K) with potential antineoplastic activity.; [http://purl.obolibrary.org/obo/NCIT_C88270],,,,FALSE,secondCompoundName
Simvastatin,A lipid-lowering agent derived synthetically from a fermentation product of the fungus Aspergillus terreus.; [http://purl.obolibrary.org/obo/NCIT_C29454],,,,FALSE,secondCompoundName
Dasatinib,An orally bioavailable synthetic small molecule-inhibitor of SRC-family protein-tyrosine kinases.; [http://purl.obolibrary.org/obo/NCIT_C38713],,,,FALSE,secondCompoundName
Sapanisertib,An orally bioavailable inhibitor of raptor-mTOR (TOR complex 1 or TORC1) and rictor-mTOR (TOR complex 2 or TORC2) with potential antineoplastic activity.; [http://purl.obolibrary.org/obo/NCIT_C90548],,,,FALSE,secondCompoundName
AR-42,"An orally available phenylbutyrate-derived histone deacetylase (HDAC) inhibitor, with potential antineoplastic activity.; [http://purl.obolibrary.org/obo/NCIT_C116850]",,,,FALSE,secondCompoundName
Axitinib,http://purl.obolibrary.org/obo/NCIT_C38718; [An orally bioavailable tyrosine kinase inhibitor.],,,,FALSE,secondCompoundName
Selumetinib,"An orally active, small molecule with potential antineoplastic activity. Selumetinib is an ATP-independent inhibitor of mitogen-activated protein kinase kinase (MEK or MAPK/ERK kinase) 1 and 2.; [http://purl.obolibrary.org/obo/NCIT_C66939]",,,,FALSE,secondCompoundName
Lapatinib,"A synthetic, orally-active quinazoline with potential antineoplastic properties. Lapatinib reversibly blocks phosphorylation of the epidermal growth factor receptor (EGFR), ErbB2, and the Erk-1 and-2 and AKT kinases; it also inhibits cyclin D protein levels in human tumor cell lines and xenografts; [http://purl.obolibrary.org/obo/NCIT_C26653]",,,,FALSE,secondCompoundName
Vistusertib,An orally bioavailable inhibitor of the mammalian target of rapamycin (mTOR) with potential antineoplastic activity.; [http://purl.obolibrary.org/obo/NCIT_C88329],,,,FALSE,secondCompoundName
Ganetespib,A synthetic small-molecule inhibitor of heat shock protein 90 (Hsp90) with potential antineoplastic activity.; [http://purl.obolibrary.org/obo/NCIT_C77872],,,,FALSE,secondCompoundName
Galunisertib,"An orally available, small molecule antagonist of the tyrosine kinase transforming growth factor-beta (TGF-b) receptor type 1 (TGFBR1), with potential antineoplastic activity.; [http://purl.obolibrary.org/obo/NCIT_C116891]",,,,FALSE,secondCompoundName
GDC-0941 Bismesylate,"The orally bioavailable bismesylate salt of a potent small-molecule thieno[3,2-d]pyrimidine inhibitor of the class I phosphatidylinositol 3 kinase (PI3K) isoforms p100alpha and p100delta with potential antineoplastic activity.; [http://purl.obolibrary.org/obo/NCIT_C82380]",,,,FALSE,secondCompoundName
Vismodegib,"An orally bioavailable small molecule with potential antineoplastic activity. Hedgehog antagonist GDC-0449 targets the Hedgehog signaling pathway, blocking the activities of the Hedgehog-ligand cell surface receptors PTCH and/or SMO and suppressing Hedgehog signaling. ; [http://purl.obolibrary.org/obo/NCIT_C74038]",,,,FALSE,secondCompoundName
AR-12,"An orally bioavailable, small-molecule, celecoxib-derived inhibitor of phosphoinositide-dependent kinase-1 (PDK1) with potential antineoplastic activity. Devoid of any COX inhibiting activity, PDK1 inhibitor AR-12 binds to and inhibits the phosphorylation of 3-phosphoinositide-dependent kinase-1 (PDK-1).; [http://purl.obolibrary.org/obo/NCIT_C88271]",,,,FALSE,secondCompoundName
Everolimus,A derivative of the natural macrocyclic lactone sirolimus with immunosuppressant and anti-angiogenic properties.; [http://purl.obolibrary.org/obo/NCIT_C48387],,,,FALSE,secondCompoundName
Vorinostat,"A synthetic hydroxamic acid derivative with antineoplastic activity. Vorinostat, a second generation polar-planar compound, binds to the catalytic domain of the histone deacetylases (HDACs).; [http://purl.obolibrary.org/obo/NCIT_C1796]",,,,FALSE,secondCompoundName
Perifosine,"An orally active alkyl-phosphocholine compound with potential antineoplastic activity. Targeting cellular membranes, perifosine modulates membrane permeability, membrane lipid composition, phospholipid metabolism, and mitogenic signal transduction, resulting in cell differentiation and inhibition of cell growth.; [http://purl.obolibrary.org/obo/NCIT_C1727]",,,,FALSE,secondCompoundName
Trametinib,An orally bioavailable inhibitor of mitogen-activated protein kinase kinase (MEK MAPK/ERK kinase) with potential antineoplastic activity.; [http://purl.obolibrary.org/obo/NCIT_C77908],,,,FALSE,secondCompoundName
GDC-0980,"An orally available agent targeting phosphatidylinositol 3 kinase (PI3K) and mammalian target of rapamycin (mTOR) kinase in the PI3K/mTOR signaling pathway, with potential antineoplastic activity.; [http://purl.obolibrary.org/obo/NCIT_C91731]",,,,FALSE,secondCompoundName
secondCompoundName,,"PD0325901, A-1210477, ABBVIE1, ABBVIE2, ABBVIE3, ABBVIE4, ABBVIE5, ABBVIE6, ABBVIE7, ABBVIE8, Venetoclax, Doxorubicin, BI 2536, Bortezomib, Carfilzomib, Culture Medium, CPD22, Crizotinib, Curcumin, Daratumumab, Defactinib, Dexamethasone, Dinaciclib, DMSO, GGTI-2418, INCB054329, IRAK-1/4 Inhibitor, IgG, Ixazomib, Selinexor, Lenalidomide, MA7-038, Melphalan, MK2206, MTI-101, Panobinostat, Pomalidomide, Ponatinib, Ricolinostat, Silmitasertib, SNS-032, SR-3029, THZ1, UMI-77, Volasertib, Fimepinostat, Brigatinib, Omipalisib, Simvastatin, Dasatinib, Sapanisertib, AR-42, Axitinib, Selumetinib, Lapatinib, Vistusertib, Ganetespib, Galunisertib, GDC-0941 Bismesylate, Vismodegib, AR-12, Everolimus, Vorinostat, Perifosine, Trametinib, GDC-0980",,,TRUE,compoundScreen
singleMolecule,An experiment in which a single molecule was used in an assay,,,,FALSE,drugScreenType
smallMoleculeLibraryScreen,"High throughput sample analysis of small molecules for purpose such as drug discovery, or biochemical, genetic or pharmacological tests.; [ http://purl.obolibrary.org/obo/ERO_0001726]",,,,FALSE,drugScreenType
combinationLibraryScreen,High throughput sample analysis of collections of compounds that provide a variety of chemically diverse structures that can be used to identify structure types that have affinity with pharmacological targets.; [http://purl.obolibrary.org/obo/ERO_0001686],,,,FALSE,drugScreenType
combinationScreen,,,,,FALSE,drugScreenType
drugScreenType,String describing general class of drug screen,"singleMolecule, smallMoleculeLibraryScreen, combinationLibraryScreen, combinationScreen",,,TRUE,compoundScreen
curatedData,,,,,FALSE,Thing
reference sequence,Syntactic sequences that has a role as reference of an annotation.; [http://rdf.biosemantics.org/ontologies/rsa#ReferenceSequence],,,,FALSE,curatedDataType
gene symbol,A unique gene name approved by an organism specific nomenclature committee.; [http://purl.obolibrary.org/obo/NCIT_C43568],,,,FALSE,curatedDataType
clinical data,Data obtained through patient examination or treatment.; [http://purl.obolibrary.org/obo/NCIT_C15783],,,,FALSE,curatedDataType
gene function,A term that expresses the function of a gene product.; [http://purl.obolibrary.org/obo/NCIT_C48933],,,,FALSE,curatedDataType
chemical descriptor,"A chemical descriptor is a data item (quantity or value) about a chemical entity that conforms to a specification for how it is calculated, measured or recorded.; [http://semanticscience.org/resource/CHEMINF_000123]",,,,FALSE,curatedDataType
curatedDataType,The type of information being curated.,"reference sequence, gene symbol, clinical data, gene function, chemical descriptor",,,TRUE,curatedData
GRCh38,Genome Reference Consortium Human Build 38; [https://www.ncbi.nlm.nih.gov/assembly/GCF_000001405.26],,,,FALSE,referenceSet
GRCh37,Genome Reference Consortium Human Build 37; [https://www.ncbi.nlm.nih.gov/assembly/GCF_000001405.13/],,,,FALSE,referenceSet
MMUL1.0,Ensembl preliminary assembly Macaca mulatta; [https://jul2016.archive.ensembl.org/Macaca_mulatta/Info/Index],,,,FALSE,referenceSet
HRC,Human haplotype reference panel; [http://www.haplotype-reference-consortium.org],,,,FALSE,referenceSet
referenceSet,"A set of references (e.g., canonical assembled contigs) which defines a common coordinate space for comparing reference-aligned experimental data.","GRCh38, GRCh37, MMUL1.0, HRC",,,TRUE,curatedData
dhart,,,,,FALSE,Thing
Project 1,The Plexiform NF project led,,,,FALSE,projectNumber
Project 2,The MPNST project,,,,FALSE,projectNumber
Project 3,The JMML project,,,,FALSE,projectNumber
Project 4,The NF1 survivor project,,,,FALSE,projectNumber
projectNumber,There are four projects on going in the spore. This describes for which one the data was collected.,"Project 1, Project 2, Project 3, Project 4",,,TRUE,dhart
genie,,,,,FALSE,Thing
staging,,,,,FALSE,fileStage
release,,,,,FALSE,fileStage
fileStage,,"staging, release",,,TRUE,genie
clinical,,,,,FALSE,cBioFileFormat
CNA,,,,,FALSE,cBioFileFormat
fusions,,,,,FALSE,cBioFileFormat
cBioFileFormat,,"clinical, CNA, fusions",,,TRUE,genie
NKI,,,,,FALSE,center
DFCI,,,,,FALSE,center
GRCC,,,,,FALSE,center
JHU,,,,,FALSE,center
MSK,,,,,FALSE,center
UHN,,,,,FALSE,center
VICC,,,,,FALSE,center
MDA,,,,,FALSE,center
center,,"NKI, DFCI, GRCC, JHU, MSK, UHN, VICC, MDA",,,TRUE,genie
array,,,,,FALSE,Thing
Cy5,Fluorescent dye used for the red channel on an array; [http://purl.obolibrary.org/obo/FBbi_00000450],,,,FALSE,channel
Cy3,Fluorescent dye used for the green channel on an array; [http://purl.obolibrary.org/obo/FBbi_00000449],,,,FALSE,channel
channel,Fluorescent color labeling for an array,"Cy5, Cy3",,,TRUE,array
analysis,,,,,FALSE,Thing
Velvet,Velvet: An algorithm for de novo short read assembly using de Bruijn graphs; [https://www.ncbi.nlm.nih.gov/pmc/articles/PMC2336801/],,,,FALSE,assemblyMethod
assemblyMethod,Algorithm used to build a reference genome from short read sequencing data.,Velvet,,,TRUE,analysis
COMBAT,An empirical Bayes gene expression batch correction method with known covariates; [https://www.ncbi.nlm.nih.gov/pubmed/16632515],,,,FALSE,batchEffectCorrectionMethod
surrogate variable analysis,Surrogate Variable Analysis: identification and adjustment for hidden confounds that are independent of a known outcome; [http://journals.plos.org/plosgenetics/article?id=10.1371/journal.pgen.0030161],,,,FALSE,batchEffectCorrectionMethod
Principal Component Analysis,Principal Component Analysis: Mathematical procedure that transforms a number of possibly correlated variables into a smaller number of uncorrelated variables called principal components.; [http://purl.bioontology.org/ontology/MESH/D025341],,,,FALSE,batchEffectCorrectionMethod
batchEffectCorrectionMethod,Methods for identifying or correcting potential confounding variables in regression analyses.,"COMBAT, surrogate variable analysis, Principal Component Analysis",,,TRUE,analysis
hierarchical clustering,"A hierarchical clustering is a data transformation which achieves a class discovery objective, which takes as input data item and builds a hierarchy of clusters. The traditional representation of this hierarchy is a tree (visualized by a dendrogram), with the individual input objects at one end (leaves) and a single cluster containing every object at the other (root).; [http://purl.obolibrary.org/obo/OBI_0200042]",,,,FALSE,clusteringMethod
k-means clustering,"A k-means clustering is a data transformation which achieves a class discovery or partitioning objective, which takes as input a collection of objects (represented as points in multidimensional space) and which partitions them into a specified number k of clusters. The algorithm attempts to find the centers of natural clusters in the data. The most common form of the algorithm starts by partitioning the input points into k initial sets, either at random or using some heuristic data. It then calculates the mean point, or centroid, of each set. It constructs a new partition by associating each point with the closest centroid. Then the centroids are recalculated for the new clusters, and the algorithm repeated by alternate applications of these two steps until convergence, which is obtained when the points no longer switch clusters (or alternatively centroids are no longer changed).; [http://purl.obolibrary.org/obo/OBI_0200041]",,,,FALSE,clusteringMethod
Weighted correlation network analysis,A data mining method typically used for studying biological networks based on pairwise correlations between variables.; [http://edamontology.org/operation_3766],,,,FALSE,clusteringMethod
principal component analysis,Principal Component Analysis: Mathematical procedure that transforms a number of possibly correlated variables into a smaller number of uncorrelated variables called principal components.; [http://purl.bioontology.org/ontology/MESH/D025341],,,,FALSE,clusteringMethod
clusteringMethod,A method to identify groups of similar variables based on their data distribution.,"hierarchical clustering, k-means clustering, Weighted correlation network analysis, principal component analysis",,,TRUE,analysis
VarDict,A DNA and RNA seq variant caller in cancer research.; [https://www.ncbi.nlm.nih.gov/pubmed/27060149],,,,FALSE,somaticMutationCallingMethod
MuTect,A method to detect DNA point mutations in heterogeneous and impure cancer samples.; [https://www.nature.com/articles/nbt.2514],,,,FALSE,somaticMutationCallingMethod
VarScan,A method to detect variants from short read DNA sequencing in individual and pooled samples.; [https://www.ncbi.nlm.nih.gov/pubmed/19542151],,,,FALSE,somaticMutationCallingMethod
somaticMutationCallingMethod,Algorithm to call somatic mutations.,"VarDict, MuTect, VarScan",,,TRUE,analysis
Benjamini Hochberg,A sequential p-value procedure that controls expected false discovery rate.; [http://ncicb.nci.nih.gov/xml/owl/EVS/Thesaurus.owl#C61596],,,,FALSE,multipleTestingAdjustmentMethod
Bonferroni,"Used in multiple comparison procedures to calculate an adjusted probability, alpha (a), of comparison-wise type I error from the desired probability aFW0 of family-wise type I error. The calculation guarantees that the use of the adjusted a in pairwise comparisons keeps the actual probability aFW of family-wise type I errors not higher than the desired level, as specified by aFW0.; [http://ncicb.nci.nih.gov/xml/owl/EVS/Thesaurus.owl#C61594]",,,,FALSE,multipleTestingAdjustmentMethod
multipleTestingAdjustmentMethod,"Method used to control either family wise error rate, false discovery rate, or other measures of burden of false positives and false negatives when performing multiple statistical tests.","Benjamini Hochberg, Bonferroni",,,TRUE,analysis
MACS,A dynamic Poisson process based method to identify ChIP-Seq peaks.; [https://genomebiology.biomedcentral.com/articles/10.1186/gb-2008-9-9-r137],,,,FALSE,peakCallingMethod
GEM,EM algorithm to identify ChIP-Seq peaks and enriched motifs.; [http://journals.plos.org/ploscompbiol/article?id=10.1371/journal.pcbi.1002638],,,,FALSE,peakCallingMethod
peakCallingMethod,The algorithm used to identify protein-binding regions in a genome sequence from the data generated from a ChIP-sequencing or ChIP-chip experiment.,"MACS, GEM",,,TRUE,analysis
kallisto,Alignment free quantification method for transcripts.; [https://www.nature.com/articles/nbt.3519],,,,FALSE,transcriptQuantificationMethod
RSEM,Transcript qunatification without a reference genome.; [https://bmcbioinformatics.biomedcentral.com/articles/10.1186/1471-2105-12-323],,,,FALSE,transcriptQuantificationMethod
featureCounts,A method for assigning sequence reads to genomic features.; [https://www.ncbi.nlm.nih.gov/pubmed/24227677],,,,FALSE,transcriptQuantificationMethod
bedtools multicov,Reports the count of alignments from multiple position-sorted and indexed BAM files that overlap intervals in a BED file.; [http://bedtools.readthedocs.io/en/latest/content/tools/multicov.html],,,,FALSE,transcriptQuantificationMethod
transcriptQuantificationMethod,Method for quantifying abundance of transcript expression.,"kallisto, RSEM, featureCounts, bedtools multicov",,,TRUE,analysis
Weighted correlation network analysis,A data mining method typically used for studying biological networks based on pairwise correlations between variables.; [http://edamontology.org/operation_3766],,,,FALSE,statisticalNetworkReconstructionMethod
SPARROW,Sparse conditional independence graph construction from gene expression data using a variational Bayes spike regression neighorhood selection method.; [https://www.ncbi.nlm.nih.gov/pubmed/?term=25583238],,,,FALSE,statisticalNetworkReconstructionMethod
Lasso,Sparse conditional independence graph construction from gene expression data using an L1 penalized regression neighborhood selection method.; [https://bmcbioinformatics.biomedcentral.com/articles/10.1186/1471-2105-10-384],,,,FALSE,statisticalNetworkReconstructionMethod
ridge,Conditional independence graph construction from gene expression using an L2^2 penalized regression neighborhood selection method.; [https://bmcbioinformatics.biomedcentral.com/articles/10.1186/1471-2105-10-384],,,,FALSE,statisticalNetworkReconstructionMethod
GENIE3,Gene expression network reconstruction using random forests.; [http://journals.plos.org/plosone/article?id=10.1371/journal.pone.0012776],,,,FALSE,statisticalNetworkReconstructionMethod
TIGRESS,Gene expression network reconstruction using stability selection.; [https://bmcsystbiol.biomedcentral.com/articles/10.1186/1752-0509-6-145],,,,FALSE,statisticalNetworkReconstructionMethod
ARACNE,Gene expression network reconstruction using mutual information.; [https://bmcbioinformatics.biomedcentral.com/articles/10.1186/1471-2105-7-S1-S7],,,,FALSE,statisticalNetworkReconstructionMethod
MRNET,An information theoretic method to infer gene expression networks.; [https://www.ncbi.nlm.nih.gov/pubmed/18354736],,,,FALSE,statisticalNetworkReconstructionMethod
C3NET,Method to infer causal relationships in gene expression networks with mutual information.; [https://bmcsystbiol.biomedcentral.com/articles/10.1186/1752-0509-4-132],,,,FALSE,statisticalNetworkReconstructionMethod
MEGENA,Multiscale Embedded Gene Co-expression Network Analysis; [http://journals.plos.org/ploscompbiol/article?id=10.1371/journal.pcbi.1004574],,,,FALSE,statisticalNetworkReconstructionMethod
WINA,,,,,FALSE,statisticalNetworkReconstructionMethod
statisticalNetworkReconstructionMethod,,"Weighted correlation network analysis, SPARROW, Lasso, ridge, GENIE3, TIGRESS, ARACNE, MRNET, C3NET, MEGENA, WINA",,,TRUE,analysis
limma,"Data analysis, linear models and differential expression for microarray data.; [http://www.ebi.ac.uk/efo/swo/SWO_0000593]",,,,FALSE,differentialExpressionMethod
sleuth,Differential expression analysis incorporating quantification uncertainty.; [https://www.nature.com/articles/nmeth.4324],,,,FALSE,differentialExpressionMethod
Cuffdiff 2,Differential expression analysis of transcripts.; [https://www.ncbi.nlm.nih.gov/pmc/articles/PMC3869392/],,,,FALSE,differentialExpressionMethod
edgeR,Estimation and Testing for Differential Expression in Multiple Digital Gene Expression Libraries.; [http://www.ebi.ac.uk/efo/swo/SWO_0000527],,,,FALSE,differentialExpressionMethod
DESeq2,"A method for differential analysis of count data, using shrinkage estimation for dispersions and fold changes.; [https://www.ncbi.nlm.nih.gov/pmc/articles/PMC4302049/]",,,,FALSE,differentialExpressionMethod
differentialExpressionMethod,Method used to test for differentially expressed genes or isoforms.,"limma, sleuth, Cuffdiff 2, edgeR, DESeq2",,,TRUE,analysis
Burrows-Wheeler technique,Burrows Wheeler Alignment algorithm.; [http://purl.obolibrary.org/obo/ERO_0100332],,,,FALSE,alignmentMethod
Bowtie,A memory efficient short read alignment algorithm.; [https://www.ncbi.nlm.nih.gov/pubmed/19261174],,,,FALSE,alignmentMethod
Bowtie 2,A memory efficient short read alignment algorithm.; [https://www.nature.com/articles/nmeth.1923],,,,FALSE,alignmentMethod
SNAPR,A pipeline for short read alignment and downstream analyses.; [https://www.ncbi.nlm.nih.gov/pubmed/29270443],,,,FALSE,alignmentMethod
GSNAP,Method to detect complex variants and splicing in short read sequencing.; [https://academic.oup.com/bioinformatics/article/26/7/873/212606],,,,FALSE,alignmentMethod
TopHat,Method to align short read sequencing for outputs such as splice junction detection.; [https://www.ncbi.nlm.nih.gov/pmc/articles/PMC2672628/],,,,FALSE,alignmentMethod
MOSAIC,Segmentation alignment method for DNA alignment.; [https://www.ncbi.nlm.nih.gov/pubmed/11238079],,,,FALSE,alignmentMethod
NovoAlign,Short read sequencing alignment method.; [http://www.novocraft.com/products/novoalign/],,,,FALSE,alignmentMethod
OLego,Alignment method to detect de novo mapping of spliced mRNA-Seq reads.; [https://www.ncbi.nlm.nih.gov/pubmed/23571760],,,,FALSE,alignmentMethod
STAR,Software based on a previously undescribed RNA-seq alignment algorithm that uses sequential maximum mappable seed search in uncompressed suffix arrays followed by seed clustering and stitching procedure.; [https://academic.oup.com/bioinformatics/article/29/1/15/272537],,,,FALSE,alignmentMethod
alignmentMethod,DNA or RNA sequence alignment method,"Burrows-Wheeler technique, Bowtie, Bowtie 2, SNAPR, GSNAP, TopHat, MOSAIC, NovoAlign, OLego, STAR",,,TRUE,analysis
CRISPR-Cas9,Genome manipulation technique to incorporate or delete arbitrary sequence features into germline cells.; [http://science.sciencemag.org/content/346/6213/1258096.full],,,,FALSE,validationMethod
RNAi,"The process in which double-stranded RNAs silence cognate genes. Involves posttranscriptional gene inactivation ('silencing') both of transgenes or dsRNA introduced into a germline, and of the host gene(s) homologous to the transgenes or dsRNA. This silencing is triggered by the introduction of transgenes or double-stranded RNA (dsRNA), and can occur through a specific decrease in the level of mRNA, or by negative regulation of translation, of both host genes and transgenes.; [http://purl.obolibrary.org/obo/GO_0016246]",,,,FALSE,validationMethod
shRNA,Short hairpin RNA (shRNA) can be used to achieve stable knockdown of gene expression. shRNA molecules are cloned into lentiviral or other vectors and expressed by a pol III type promoter.; [http://www.bioassayontology.org/bao#BAO_0000323],,,,FALSE,validationMethod
validationMethod,Method to test targeted sequence level hypothesis.,"CRISPR-Cas9, RNAi, shRNA",,,TRUE,analysis
Fisher's exact test,"Fisher's exact test is a data transformation used to determine if there are nonrandom associations between two Fisher's exact test is a statistical significance test used in the analysis of contingency tables where sample sizes are small where the significance of the deviation from a null hypothesis can be calculated exactly, rather than relying on an approximation that becomes exact in the limit as the sample size grows to infinity, as with many statistical tests.; [http://purl.obolibrary.org/obo/OBI_0200176]",,,,FALSE,enrichmentMethod
DAVID,All tools in the DAVID Bioinformatics Resources aim to provide functional interpretation of large lists of genes derived from genomic studies.; [https://david.ncifcrf.gov],,,,FALSE,enrichmentMethod
GSEA,A method to identify pathway enrichment in a sample set of genes.; [http://www.pnas.org/content/102/43/15545],,,,FALSE,enrichmentMethod
Enrichr,A comprehensive resource for curated gene sets and a search engine that accumulates biological knowledge for further biological discoveries.; [https://www.ncbi.nlm.nih.gov/pmc/articles/PMC4987924/],,,,FALSE,enrichmentMethod
ssGSEA,A single sample extension of GSEA that allows one to define an enrichment score that represents the degree of absolute enrichment of a gene set in each sample within a given data set.; [https://www.ncbi.nlm.nih.gov/pubmed/19847166],,,,FALSE,enrichmentMethod
GSVA,A GSE method that estimates variation of pathway activity over a sample population in an unsupervised manner.; [https://www.ncbi.nlm.nih.gov/pmc/articles/PMC3618321/],,,,FALSE,enrichmentMethod
enrichmentMethod,,"Fisher's exact test, DAVID, GSEA, Enrichr, ssGSEA, GSVA",,,TRUE,analysis
