Attribute,Description,Valid Values,Requires,Properties,Required,Parent
mouth pipette,; [https://github.com/HumanCellAtlas/metadata-schema/blob/master/json_schema/type/process/sequencing/library_preparation_process.json],,,,FALSE,dissociationMethod
bulk,; [https://github.com/HumanCellAtlas/metadata-schema/blob/master/json_schema/type/process/sequencing/library_preparation_process.json],,,,FALSE,dissociationMethod
enzymatic,; [https://github.com/HumanCellAtlas/metadata-schema/blob/master/json_schema/type/process/sequencing/library_preparation_process.json],,,,FALSE,dissociationMethod
mechanical,; [https://github.com/HumanCellAtlas/metadata-schema/blob/master/json_schema/type/process/sequencing/library_preparation_process.json],,,,FALSE,dissociationMethod
none,; [https://github.com/HumanCellAtlas/metadata-schema/blob/master/json_schema/type/process/sequencing/library_preparation_process.json],,,,FALSE,dissociationMethod
dissociationMethod,," 10x_v2, FACS, Fluidigm C1, drop-seq, inDrop, mouth pipette, bulk, enzymatic, mechanical, none",,,TRUE,ngs
chem,,,,,FALSE,Thing
target,The role of a molecular entity (protein or nucleic acid) that is the presumed subject of an assay and whose activity is being regulated by an entity with a perturbagen role in that assay.; [http://www.bioassayontology.org/bao#BAO_0003064],,,,FALSE,chemicalDataType
chemical structure,A representation of the arrangement of atoms and bonds. ; [http://purl.obolibrary.org/obo/NCIT_C103240],,,,FALSE,chemicalDataType
chemical hashed fingerprint,The chemical hashed fingerprint of a molecule is bit string (a sequence of 0 and 1 digits) that contains information on the structure.; [https://docs.chemaxon.com/display/docs/Chemical+Hashed+Fingerprint],,,,FALSE,chemicalDataType
complex database,A database with several types of chemical data; [Sage Bionetworks],,,,FALSE,chemicalDataType
chemical identifier,A chemical identifier is an identifier for a chemical entity; [http://semanticscience.org/resource/SIO_000728],,,,FALSE,chemicalDataType
chemicalDataType,The type of chemical data in the dataset.,"target, chemical structure, chemical hashed fingerprint, complex database, chemical identifier",,,TRUE,chem
standard,"Considers paths of a given length. These are hashed fingerprints, with a default length of 1024.; [https://www.rdocumentation.org/packages/rcdk/versions/3.4.5/topics/get.fingerprint]",,,,FALSE,fingerprintType
extended,"Similar to the standard type, but takes rings and atomic properties into account into account.; [https://www.rdocumentation.org/packages/rcdk/versions/3.4.5/topics/get.fingerprint]",,,,FALSE,fingerprintType
maccs,The popular 166 bit MACCS keys described by MDL.; [https://www.rdocumentation.org/packages/rcdk/versions/3.4.5/topics/get.fingerprint],,,,FALSE,fingerprintType
pubchem,881 bit fingerprints defined by PubChem.; [https://www.rdocumentation.org/packages/rcdk/versions/3.4.5/topics/get.fingerprint],,,,FALSE,fingerprintType
kr,4860 bit fingerprint defined by Klekota and Roth.; [https://www.rdocumentation.org/packages/rcdk/versions/3.4.5/topics/get.fingerprint],,,,FALSE,fingerprintType
circular,An implementation of the ECFP6 fingerprint.; [https://www.rdocumentation.org/packages/rcdk/versions/3.4.5/topics/get.fingerprint],,,,FALSE,fingerprintType
fingerprintType,The type of chemical fingerprint used.,"standard, extended, maccs, pubchem, kr, circular",,,TRUE,chem
SMILES,Specification for unambiguously describing the structure of a chemical compound using a short ASCII string.; [http://purl.obolibrary.org/obo/MS_1000868],,,,FALSE,structureFormat
InChI,A textual identifier for chemical substances designed to provide a standard and human-readable way to encode molecular information that also facilitates searches in printed and electronic data sources.; [http://purl.obolibrary.org/obo/NCIT_C54683],,,,FALSE,structureFormat
SDF,SDF is one of a family of chemical-data file formats developed by MDL Information Systems; it is intended especially for structural information.; [http://edamontology.org/format_3814],,,,FALSE,structureFormat
structureFormat,The chemical structural representation used.,"SMILES, InChI, SDF",,,TRUE,chem
compoundScreen,,,,,FALSE,Thing
PD0325901,"An orally bioavailable, synthetic organic molecule targeting mitogen-activated protein kinase kinase (MAPK/ERK kinase or MEK) with potential antineoplastic activity. MEK inhibitor PD325901, a derivative of MEK inhibitor CI-1040, selectively binds to and inhibits MEK, which may result in the inhibition of the phosphorylation and activation of MAPK/ERK and the inhibition of tumor cell proliferation. The dual specific threonine/tyrosine kinase MEK is a key component of the RAS/RAF/MEK/ERK signaling pathway that is frequently activated in human tumors.; [http://purl.obolibrary.org/obo/NCIT_C52195]",,,,FALSE,compoundName
A-1210477,An MCL-1 inhibitor.; [https://www.ncbi.nlm.nih.gov/mesh/2015744],,,,FALSE,compoundName
ABBVIE1,Internal research compound.; [Moffitt],,,,FALSE,compoundName
ABBVIE2,Internal research compound.; [Moffitt],,,,FALSE,compoundName
ABBVIE3,Internal research compound.; [Moffitt],,,,FALSE,compoundName
ABBVIE4,Internal research compound.; [Moffitt],,,,FALSE,compoundName
ABBVIE5,Internal research compound.; [Moffitt],,,,FALSE,compoundName
ABBVIE6,Internal research compound.; [Moffitt],,,,FALSE,compoundName
ABBVIE7,Internal research compound.; [Moffitt],,,,FALSE,compoundName
ABBVIE8,Internal research compound.; [Moffitt],,,,FALSE,compoundName
Venetoclax,"An orally bioavailable, selective small molecule inhibitor of the anti-apoptotic protein Bcl-2, with potential antineoplastic activity.; [http://purl.obolibrary.org/obo/NCIT_C103147]",,,,FALSE,compoundName
Doxorubicin,An anthracycline antibiotic with antineoplastic activity.; [http://purl.obolibrary.org/obo/NCIT_C456],,,,FALSE,compoundName
BI 2536,"A small molecule compound with potential antineoplastic activities. BI 2536 binds to and inhibits Polo-like kinase 1 (Plk1), resulting in mitotic arrest, disruption of cytokinesis, and apoptosis in susceptible tumor cell populations.; [http://purl.obolibrary.org/obo/NCIT_C49091]",,,,FALSE,compoundName
Bortezomib,"A dipeptide boronic acid analogue with antineoplastic activity. Bortezomib reversibly inhibits the 26S proteasome, a large protease complex that degrades ubiquinated proteins.; [http://purl.obolibrary.org/obo/NCIT_C1851]",,,,FALSE,compoundName
Carfilzomib,"An epoxomicin derivate with potential antineoplastic activity. Carfilzomib irreversibly binds to and inhibits the chymotrypsin-like activity of the 20S catalytic core subunit of the proteasome, a protease complex responsible for degrading a large variety of cellular proteins.; [http://purl.obolibrary.org/obo/NCIT_C52196]",,,,FALSE,compoundName
Culture Medium,"A liquid or gel containing nutrients, salts, and other factors formulated to support the growth of microorganisms, cells, or plants.; [http://purl.obolibrary.org/obo/NCIT_C85504]",,,,FALSE,compoundName
CPD22,"A novel ILK inhibitor, which exhibit[s] high in vitro potency against a panel of prostate and breast cancer cell lines.; [https://www.ncbi.nlm.nih.gov/pubmed/21823616]",,,,FALSE,compoundName
Crizotinib,An orally available aminopyridine-based inhibitor of the receptor tyrosine kinase anaplastic lymphoma kinase (ALK) and the c-Met/hepatocyte growth factor receptor (HGFR) with antineoplastic activity.; [http://purl.obolibrary.org/obo/NCIT_C74061],,,,FALSE,compoundName
Curcumin,"A phytopolylphenol pigment isolated from the plant Curcuma longa, commonly known as turmeric, with a variety of pharmacologic properties.; [http://purl.obolibrary.org/obo/NCIT_C401]",,,,FALSE,compoundName
Daratumumab,A fully human monoclonal antibody directed against the cell surface glycoprotein CD-38 with potential antineoplastic activity.; [http://purl.obolibrary.org/obo/NCIT_C74007],,,,FALSE,compoundName
Defactinib,"An orally bioavailable, small-molecule focal adhesion kinase (FAK) inhibitor with potential antiangiogenic and antineoplastic activities.; [http://purl.obolibrary.org/obo/NCIT_C79809]",,,,FALSE,compoundName
Dexamethasone,A synthetic adrenal corticosteroid with potent anti-inflammatory properties.; [http://purl.obolibrary.org/obo/NCIT_C422],,,,FALSE,compoundName
Dinaciclib,"A pyrazolo[1,5-a]pyrimidine with potential antineoplastic activity. Dinaciclib selectively inhibits cyclin dependent kinases CDK1, CDK2, CDK5, and CDK9.; [http://purl.obolibrary.org/obo/NCIT_C78854]",,,,FALSE,compoundName
DMSO,A highly polar organic liquid that is used widely as a chemical solvent and a free radical scavenger.; [http://purl.obolibrary.org/obo/NCIT_C437],,,,FALSE,compoundName
GGTI-2418,A potent and selective peptidomimetic inhibitor of geranylgeranyltransferase I (GGTI).; [https://www.ncbi.nlm.nih.gov/pubmed/19204084],,,,FALSE,compoundName
INCB054329,An inhibitor of the Bromodomain and Extra-Terminal (BET) family of bromodomain-containing proteins with potential antineoplastic activity.; [http://purl.obolibrary.org/obo/NCIT_C121948],,,,FALSE,compoundName
IRAK-1/4 Inhibitor,Interleukin-1 Receptor-Associated-Kinase-1/4 Inhibitor.; [https://pubchem.ncbi.nlm.nih.gov/compound/IRAK-1_4_Inhibitor],,,,FALSE,compoundName
IgG,An immunoglobulin isotype (subclass) that characterizes secondary immune responses.; [http://purl.obolibrary.org/obo/NCIT_C568],,,,FALSE,compoundName
Ixazomib,"An active metabolite of MLN9708, a second generation, boron containing peptide proteasome inhibitor (PI) with potential antineoplastic activity.; [http://purl.obolibrary.org/obo/NCIT_C97940]",,,,FALSE,compoundName
Selinexor,"An orally available, small molecule inhibitor of CRM1 (chromosome region maintenance 1 protein, exportin 1 or XPO1), with potential antineoplastic activity.; [http://purl.obolibrary.org/obo/NCIT_C102546]",,,,FALSE,compoundName
Lenalidomide,A thalidomide analog with potential antineoplastic activity.; [http://purl.obolibrary.org/obo/NCIT_C2668],,,,FALSE,compoundName
MA7-038,Internal research compound.; [Moffitt],,,,FALSE,compoundName
Melphalan,A phenylalanine derivative of nitrogen mustard with antineoplastic activity.; [http://purl.obolibrary.org/obo/NCIT_C633],,,,FALSE,compoundName
MK2206,An orally bioavailable allosteric inhibitor of the serine/threonine protein kinase Akt (protein kinase B) with potential antineoplastic activity.; [http://purl.obolibrary.org/obo/NCIT_C90581],,,,FALSE,compoundName
MTI-101,MTI-101 (cyclized HYD1) binds a CD44 containing complex.; [https://www.ncbi.nlm.nih.gov/pubmed/24048737],,,,FALSE,compoundName
Panobinostat,A cinnamic hydroxamic acid analogue with potential antineoplastic activity. Panobinostat selectively inhibits histone deacetylase (HDAC).; [http://purl.obolibrary.org/obo/NCIT_C66948],,,,FALSE,compoundName
Pomalidomide,"An orally bioavailable derivative of thalidomide with potential immunomodulating, antiangiogenic and antineoplastic activities.; [http://purl.obolibrary.org/obo/NCIT_C72560]",,,,FALSE,compoundName
Ponatinib,An orally bioavailable multitargeted receptor tyrosine kinase (RTK) inhibitor with potential antiangiogenic and antineoplastic activities.; [http://purl.obolibrary.org/obo/NCIT_C95777],,,,FALSE,compoundName
Ricolinostat,"An orally bioavailable, specific inhibitor of histone deacetylase 6 (HDAC6) with potential antineoplastic activity.; [http://purl.obolibrary.org/obo/NCIT_C96431]",,,,FALSE,compoundName
Silmitasertib,Silmitasertib selectively binds to and inhibits the enzyme casein kinase II (CK2); [http://purl.obolibrary.org/obo/NCIT_C98054],,,,FALSE,compoundName
SNS-032,A small aminothiazole molecule and cyclin dependent kinase (CDK) inhibitor with potential antineoplastic activity.; [http://purl.obolibrary.org/obo/NCIT_C62523],,,,FALSE,compoundName
SR-3029,Highly selective casein kinase 1delta/1epsilon inhibitor with potent antiproliferative properties.; [https://www.ncbi.nlm.nih.gov/mesh/67585785],,,,FALSE,compoundName
THZ1,A low nanomolar inhibitor of cell proliferation and biochemical CDK7 activity.; [https://www.ncbi.nlm.nih.gov/pmc/articles/PMC4244910/],,,,FALSE,compoundName
UMI-77,An Mcl-1 inhibitor.; [https://www.ncbi.nlm.nih.gov/mesh/2003359],,,,FALSE,compoundName
Volasertib,A dihydropteridinone Polo-like kinase 1 (Plk1) inhibitor with potential antineoplastic activity.; [http://purl.obolibrary.org/obo/NCIT_C79844],,,,FALSE,compoundName
Fimepinostat,"An orally bioavailable inhibitor of both phosphoinositide 3-kinase (PI3K) class I and pan histone deacetylase (HDAC) enzymes, with potential antineoplastic activity.; [http://purl.obolibrary.org/obo/NCIT_C104008]",,,,FALSE,compoundName
Brigatinib,An orally available inhibitor of receptor tyrosine kinases anaplastic lymphoma kinase (ALK) and the epidermal growth factor receptor (EGFR) with potential antineoplastic activity.; [http://purl.obolibrary.org/obo/NCIT_C98831],,,,FALSE,compoundName
Omipalisib,A small-molecule pyridylsulfonamide inhibitor of phosphatidylinositol 3-kinase (PI3K) with potential antineoplastic activity.; [http://purl.obolibrary.org/obo/NCIT_C88270],,,,FALSE,compoundName
Simvastatin,A lipid-lowering agent derived synthetically from a fermentation product of the fungus Aspergillus terreus.; [http://purl.obolibrary.org/obo/NCIT_C29454],,,,FALSE,compoundName
Dasatinib,An orally bioavailable synthetic small molecule-inhibitor of SRC-family protein-tyrosine kinases.; [http://purl.obolibrary.org/obo/NCIT_C38713],,,,FALSE,compoundName
Sapanisertib,An orally bioavailable inhibitor of raptor-mTOR (TOR complex 1 or TORC1) and rictor-mTOR (TOR complex 2 or TORC2) with potential antineoplastic activity.; [http://purl.obolibrary.org/obo/NCIT_C90548],,,,FALSE,compoundName
AR-42,"An orally available phenylbutyrate-derived histone deacetylase (HDAC) inhibitor, with potential antineoplastic activity.; [http://purl.obolibrary.org/obo/NCIT_C116850]",,,,FALSE,compoundName
Axitinib,http://purl.obolibrary.org/obo/NCIT_C38718; [An orally bioavailable tyrosine kinase inhibitor.],,,,FALSE,compoundName
Selumetinib,"An orally active, small molecule with potential antineoplastic activity. Selumetinib is an ATP-independent inhibitor of mitogen-activated protein kinase kinase (MEK or MAPK/ERK kinase) 1 and 2.; [http://purl.obolibrary.org/obo/NCIT_C66939]",,,,FALSE,compoundName
Lapatinib,"A synthetic, orally-active quinazoline with potential antineoplastic properties. Lapatinib reversibly blocks phosphorylation of the epidermal growth factor receptor (EGFR), ErbB2, and the Erk-1 and-2 and AKT kinases; it also inhibits cyclin D protein levels in human tumor cell lines and xenografts; [http://purl.obolibrary.org/obo/NCIT_C26653]",,,,FALSE,compoundName
Vistusertib,An orally bioavailable inhibitor of the mammalian target of rapamycin (mTOR) with potential antineoplastic activity.; [http://purl.obolibrary.org/obo/NCIT_C88329],,,,FALSE,compoundName
Ganetespib,A synthetic small-molecule inhibitor of heat shock protein 90 (Hsp90) with potential antineoplastic activity.; [http://purl.obolibrary.org/obo/NCIT_C77872],,,,FALSE,compoundName
Galunisertib,"An orally available, small molecule antagonist of the tyrosine kinase transforming growth factor-beta (TGF-b) receptor type 1 (TGFBR1), with potential antineoplastic activity.; [http://purl.obolibrary.org/obo/NCIT_C116891]",,,,FALSE,compoundName
GDC-0941 Bismesylate,"The orally bioavailable bismesylate salt of a potent small-molecule thieno[3,2-d]pyrimidine inhibitor of the class I phosphatidylinositol 3 kinase (PI3K) isoforms p100alpha and p100delta with potential antineoplastic activity.; [http://purl.obolibrary.org/obo/NCIT_C82380]",,,,FALSE,compoundName
Vismodegib,"An orally bioavailable small molecule with potential antineoplastic activity. Hedgehog antagonist GDC-0449 targets the Hedgehog signaling pathway, blocking the activities of the Hedgehog-ligand cell surface receptors PTCH and/or SMO and suppressing Hedgehog signaling. ; [http://purl.obolibrary.org/obo/NCIT_C74038]",,,,FALSE,compoundName
AR-12,"An orally bioavailable, small-molecule, celecoxib-derived inhibitor of phosphoinositide-dependent kinase-1 (PDK1) with potential antineoplastic activity. Devoid of any COX inhibiting activity, PDK1 inhibitor AR-12 binds to and inhibits the phosphorylation of 3-phosphoinositide-dependent kinase-1 (PDK-1).; [http://purl.obolibrary.org/obo/NCIT_C88271]",,,,FALSE,compoundName
Everolimus,A derivative of the natural macrocyclic lactone sirolimus with immunosuppressant and anti-angiogenic properties.; [http://purl.obolibrary.org/obo/NCIT_C48387],,,,FALSE,compoundName
Vorinostat,"A synthetic hydroxamic acid derivative with antineoplastic activity. Vorinostat, a second generation polar-planar compound, binds to the catalytic domain of the histone deacetylases (HDACs).; [http://purl.obolibrary.org/obo/NCIT_C1796]",,,,FALSE,compoundName
Perifosine,"An orally active alkyl-phosphocholine compound with potential antineoplastic activity. Targeting cellular membranes, perifosine modulates membrane permeability, membrane lipid composition, phospholipid metabolism, and mitogenic signal transduction, resulting in cell differentiation and inhibition of cell growth.; [http://purl.obolibrary.org/obo/NCIT_C1727]",,,,FALSE,compoundName
Trametinib,An orally bioavailable inhibitor of mitogen-activated protein kinase kinase (MEK MAPK/ERK kinase) with potential antineoplastic activity.; [http://purl.obolibrary.org/obo/NCIT_C77908],,,,FALSE,compoundName
GDC-0980,"An orally available agent targeting phosphatidylinositol 3 kinase (PI3K) and mammalian target of rapamycin (mTOR) kinase in the PI3K/mTOR signaling pathway, with potential antineoplastic activity.; [http://purl.obolibrary.org/obo/NCIT_C91731]",,,,FALSE,compoundName
compoundName,,"PD0325901, A-1210477, ABBVIE1, ABBVIE2, ABBVIE3, ABBVIE4, ABBVIE5, ABBVIE6, ABBVIE7, ABBVIE8, Venetoclax, Doxorubicin, BI 2536, Bortezomib, Carfilzomib, Culture Medium, CPD22, Crizotinib, Curcumin, Daratumumab, Defactinib, Dexamethasone, Dinaciclib, DMSO, GGTI-2418, INCB054329, IRAK-1/4 Inhibitor, IgG, Ixazomib, Selinexor, Lenalidomide, MA7-038, Melphalan, MK2206, MTI-101, Panobinostat, Pomalidomide, Ponatinib, Ricolinostat, Silmitasertib, SNS-032, SR-3029, THZ1, UMI-77, Volasertib, Fimepinostat, Brigatinib, Omipalisib, Simvastatin, Dasatinib, Sapanisertib, AR-42, Axitinib, Selumetinib, Lapatinib, Vistusertib, Ganetespib, Galunisertib, GDC-0941 Bismesylate, Vismodegib, AR-12, Everolimus, Vorinostat, Perifosine, Trametinib, GDC-0980",,,TRUE,compoundScreen
PD0325901,"An orally bioavailable, synthetic organic molecule targeting mitogen-activated protein kinase kinase (MAPK/ERK kinase or MEK) with potential antineoplastic activity. MEK inhibitor PD325901, a derivative of MEK inhibitor CI-1040, selectively binds to and inhibits MEK, which may result in the inhibition of the phosphorylation and activation of MAPK/ERK and the inhibition of tumor cell proliferation. The dual specific threonine/tyrosine kinase MEK is a key component of the RAS/RAF/MEK/ERK signaling pathway that is frequently activated in human tumors.; [http://purl.obolibrary.org/obo/NCIT_C52195]",,,,FALSE,secondCompoundName
A-1210477,An MCL-1 inhibitor.; [https://www.ncbi.nlm.nih.gov/mesh/2015744],,,,FALSE,secondCompoundName
ABBVIE1,Internal research compound.; [Moffitt],,,,FALSE,secondCompoundName
ABBVIE2,Internal research compound.; [Moffitt],,,,FALSE,secondCompoundName
ABBVIE3,Internal research compound.; [Moffitt],,,,FALSE,secondCompoundName
ABBVIE4,Internal research compound.; [Moffitt],,,,FALSE,secondCompoundName
ABBVIE5,Internal research compound.; [Moffitt],,,,FALSE,secondCompoundName
ABBVIE6,Internal research compound.; [Moffitt],,,,FALSE,secondCompoundName
ABBVIE7,Internal research compound.; [Moffitt],,,,FALSE,secondCompoundName
ABBVIE8,Internal research compound.; [Moffitt],,,,FALSE,secondCompoundName
Venetoclax,"An orally bioavailable, selective small molecule inhibitor of the anti-apoptotic protein Bcl-2, with potential antineoplastic activity.; [http://purl.obolibrary.org/obo/NCIT_C103147]",,,,FALSE,secondCompoundName
Doxorubicin,An anthracycline antibiotic with antineoplastic activity.; [http://purl.obolibrary.org/obo/NCIT_C456],,,,FALSE,secondCompoundName
BI 2536,"A small molecule compound with potential antineoplastic activities. BI 2536 binds to and inhibits Polo-like kinase 1 (Plk1), resulting in mitotic arrest, disruption of cytokinesis, and apoptosis in susceptible tumor cell populations.; [http://purl.obolibrary.org/obo/NCIT_C49091]",,,,FALSE,secondCompoundName
Bortezomib,"A dipeptide boronic acid analogue with antineoplastic activity. Bortezomib reversibly inhibits the 26S proteasome, a large protease complex that degrades ubiquinated proteins.; [http://purl.obolibrary.org/obo/NCIT_C1851]",,,,FALSE,secondCompoundName
Carfilzomib,"An epoxomicin derivate with potential antineoplastic activity. Carfilzomib irreversibly binds to and inhibits the chymotrypsin-like activity of the 20S catalytic core subunit of the proteasome, a protease complex responsible for degrading a large variety of cellular proteins.; [http://purl.obolibrary.org/obo/NCIT_C52196]",,,,FALSE,secondCompoundName
Culture Medium,"A liquid or gel containing nutrients, salts, and other factors formulated to support the growth of microorganisms, cells, or plants.; [http://purl.obolibrary.org/obo/NCIT_C85504]",,,,FALSE,secondCompoundName
CPD22,"A novel ILK inhibitor, which exhibit[s] high in vitro potency against a panel of prostate and breast cancer cell lines.; [https://www.ncbi.nlm.nih.gov/pubmed/21823616]",,,,FALSE,secondCompoundName
Crizotinib,An orally available aminopyridine-based inhibitor of the receptor tyrosine kinase anaplastic lymphoma kinase (ALK) and the c-Met/hepatocyte growth factor receptor (HGFR) with antineoplastic activity.; [http://purl.obolibrary.org/obo/NCIT_C74061],,,,FALSE,secondCompoundName
Curcumin,"A phytopolylphenol pigment isolated from the plant Curcuma longa, commonly known as turmeric, with a variety of pharmacologic properties.; [http://purl.obolibrary.org/obo/NCIT_C401]",,,,FALSE,secondCompoundName
Daratumumab,A fully human monoclonal antibody directed against the cell surface glycoprotein CD-38 with potential antineoplastic activity.; [http://purl.obolibrary.org/obo/NCIT_C74007],,,,FALSE,secondCompoundName
Defactinib,"An orally bioavailable, small-molecule focal adhesion kinase (FAK) inhibitor with potential antiangiogenic and antineoplastic activities.; [http://purl.obolibrary.org/obo/NCIT_C79809]",,,,FALSE,secondCompoundName
Dexamethasone,A synthetic adrenal corticosteroid with potent anti-inflammatory properties.; [http://purl.obolibrary.org/obo/NCIT_C422],,,,FALSE,secondCompoundName
Dinaciclib,"A pyrazolo[1,5-a]pyrimidine with potential antineoplastic activity. Dinaciclib selectively inhibits cyclin dependent kinases CDK1, CDK2, CDK5, and CDK9.; [http://purl.obolibrary.org/obo/NCIT_C78854]",,,,FALSE,secondCompoundName
DMSO,A highly polar organic liquid that is used widely as a chemical solvent and a free radical scavenger.; [http://purl.obolibrary.org/obo/NCIT_C437],,,,FALSE,secondCompoundName
GGTI-2418,A potent and selective peptidomimetic inhibitor of geranylgeranyltransferase I (GGTI).; [https://www.ncbi.nlm.nih.gov/pubmed/19204084],,,,FALSE,secondCompoundName
INCB054329,An inhibitor of the Bromodomain and Extra-Terminal (BET) family of bromodomain-containing proteins with potential antineoplastic activity.; [http://purl.obolibrary.org/obo/NCIT_C121948],,,,FALSE,secondCompoundName
IRAK-1/4 Inhibitor,Interleukin-1 Receptor-Associated-Kinase-1/4 Inhibitor.; [https://pubchem.ncbi.nlm.nih.gov/compound/IRAK-1_4_Inhibitor],,,,FALSE,secondCompoundName
IgG,An immunoglobulin isotype (subclass) that characterizes secondary immune responses.; [http://purl.obolibrary.org/obo/NCIT_C568],,,,FALSE,secondCompoundName
Ixazomib,"An active metabolite of MLN9708, a second generation, boron containing peptide proteasome inhibitor (PI) with potential antineoplastic activity.; [http://purl.obolibrary.org/obo/NCIT_C97940]",,,,FALSE,secondCompoundName
Selinexor,"An orally available, small molecule inhibitor of CRM1 (chromosome region maintenance 1 protein, exportin 1 or XPO1), with potential antineoplastic activity.; [http://purl.obolibrary.org/obo/NCIT_C102546]",,,,FALSE,secondCompoundName
Lenalidomide,A thalidomide analog with potential antineoplastic activity.; [http://purl.obolibrary.org/obo/NCIT_C2668],,,,FALSE,secondCompoundName
MA7-038,Internal research compound.; [Moffitt],,,,FALSE,secondCompoundName
Melphalan,A phenylalanine derivative of nitrogen mustard with antineoplastic activity.; [http://purl.obolibrary.org/obo/NCIT_C633],,,,FALSE,secondCompoundName
MK2206,An orally bioavailable allosteric inhibitor of the serine/threonine protein kinase Akt (protein kinase B) with potential antineoplastic activity.; [http://purl.obolibrary.org/obo/NCIT_C90581],,,,FALSE,secondCompoundName
MTI-101,MTI-101 (cyclized HYD1) binds a CD44 containing complex.; [https://www.ncbi.nlm.nih.gov/pubmed/24048737],,,,FALSE,secondCompoundName
Panobinostat,A cinnamic hydroxamic acid analogue with potential antineoplastic activity. Panobinostat selectively inhibits histone deacetylase (HDAC).; [http://purl.obolibrary.org/obo/NCIT_C66948],,,,FALSE,secondCompoundName
Pomalidomide,"An orally bioavailable derivative of thalidomide with potential immunomodulating, antiangiogenic and antineoplastic activities.; [http://purl.obolibrary.org/obo/NCIT_C72560]",,,,FALSE,secondCompoundName
Ponatinib,An orally bioavailable multitargeted receptor tyrosine kinase (RTK) inhibitor with potential antiangiogenic and antineoplastic activities.; [http://purl.obolibrary.org/obo/NCIT_C95777],,,,FALSE,secondCompoundName
Ricolinostat,"An orally bioavailable, specific inhibitor of histone deacetylase 6 (HDAC6) with potential antineoplastic activity.; [http://purl.obolibrary.org/obo/NCIT_C96431]",,,,FALSE,secondCompoundName
